{
  "$schema": "https://json-schema.org/draft/2020-12/schema",
  "additionalProperties": false,
  "properties": {
    "address": {
      "description": "Loopback address used by the embedded Console Web server.",
      "type": "string"
    },
    "agent_home": {
      "description": "Private state root for the restricted Console Agent.",
      "type": "string"
    },
    "agent_configuration_store": {
      "description": "Host-owned SQLite authority for durable Console Agent configuration proposals, publication history, and desired-state recovery.",
      "type": "string"
    },
    "allowed_tools": {
      "description": "Reviewed model-visible Tools admitted to the Console Agent.",
      "items": {
        "type": "string"
      },
      "type": "array"
    },
    "connected_agent_label": {
      "description": "Identity label for the optional App Agent contributed to this Console.",
      "type": "string"
    },
    "console_agent_url": {
      "description": "Clean loopback HTTP origin of the separately released Console Agent process.",
      "type": "string"
    },
    "connected_agent_plugin_configuration": {
      "description": "Explicitly authorizes Console to consume the App Agent Host's Plugin configuration capability.",
      "type": "boolean"
    },
    "connected_agent_plugin_lifecycle": {
      "description": "Explicitly authorizes Console to consume the App Agent Host's trusted Plugin package lifecycle capability.",
      "type": "boolean"
    },
    "connected_agent_url": {
      "description": "Clean loopback HTTP origin used by the optional App Agent Adapter.",
      "type": "string"
    },
    "managed_app_root": {
      "description": "Lenso App whose ordinary Plugin Root is managed by Console.",
      "type": "string"
    },
    "trusted_plugin_bundles": {
      "additionalProperties": {
        "type": "string"
      },
      "description": "Host-private trusted Bundle catalog keyed by opaque entry ID. Paths resolve from the launcher directory and are never exposed to Console Agent.",
      "type": "object"
    },
    "web_root": {
      "description": "Directory containing the built Console Shell index.html.",
      "type": "string"
    },
    "managed_apps": {
      "type": "array",
      "description": "Explicit Plugin management connections for non-Agent Apps and the Console extension authority. These targets do not become conversational Agents.",
      "items": {
        "type": "object",
        "additionalProperties": false,
        "required": ["id", "label", "origin"],
        "properties": {
          "id": {
            "type": "string",
            "pattern": "^[a-z][a-z0-9._-]{0,63}$"
          },
          "label": {
            "type": "string",
            "minLength": 1
          },
          "origin": {
            "type": "string"
          },
          "consoleExtensions": {
            "type": "boolean",
            "default": false
          },
          "controlTokenEnv": {
            "type": ["string", "null"]
          }
        }
      },
      "default": []
    }
  },
  "required": [
    "address",
    "agent_home",
    "agent_configuration_store",
    "allowed_tools",
    "connected_agent_label",
    "connected_agent_plugin_configuration",
    "connected_agent_plugin_lifecycle",
    "connected_agent_url",
    "console_agent_url",
    "managed_app_root",
    "trusted_plugin_bundles",
    "web_root"
  ],
  "type": "object"
}
