{
  "address": "127.0.0.1:3030",
  "agent_home": ".lenso/console/agent",
  "agent_configuration_store": ".lenso/console/agent-configuration.sqlite3",
  "allowed_tools": [
    "inspect_app",
    "list_plugins",
    "inspect_plugin",
    "check_plugin_change",
    "apply_plugin_change",
    "list_plugin_changes",
    "check_plugin_rollback",
    "apply_plugin_rollback",
    "set_plugin_enabled",
    "list_available_plugins",
    "check_plugin_install",
    "apply_plugin_install",
    "check_plugin_removal",
    "apply_plugin_removal"
  ],
  "connected_agent_label": "Lenso Agent",
  "connected_agent_plugin_configuration": false,
  "connected_agent_plugin_lifecycle": false,
  "connected_agent_url": "",
  "console_agent_url": "http://127.0.0.1:8788",
  "managed_app_root": ".",
  "trusted_plugin_bundles": {},
  "web_root": "console-web",
  "managed_apps": []
}
